function name, return type, parameters, explanation
example_func, String, "age: int, name: String = ""foo"", param: Variant = null", does a few [b]different[/b] things 
show, , , shows the current scene
hide, , , hides the current scene
move_forward, , "pixels: int" , moves the turtle in the direction it's facing by some pixels
turn_right, , "degrees: int", rotates the turtle to the right by some degrees
turn_left, , "degrees: int", rotates the turtle to the left by some degrees
rotate, ,radians: float, applies a rotation to the node, in radians, starting from its current rotation.